{"bundle_id":"ardur-agentic-policy-conformance-v0.1","bundle_schema_version":"ardur.policy_conformance_bundle.v0.1","bundle_sha256":"8354be6d7a54bb1e4c9e0cde09d9e2c22fb615b913ffcacef12701ef87f02826","claim_boundary":"Deterministic Ardur policy and delegation self-test. Provenance labels model why an action was requested; they are not semantic-content detection.","evidence_class":"implementation-self-test","not_claimed":["semantic prompt-injection detection","artifact malware detection","live model-provider behavior","independent security certification","runtime host-effect observation"],"ok":true,"scenarios":[{"decision":"PERMIT","failures":[],"policy_path":"native","reason_code":"within_scope","receipt_id":"receipt:bca7f18360493b5d5dea824386dde233","receipt_verification":"verified","risk_class":"baseline","scenario_id":"POLICY-PERMIT-BASELINE-READ","verifier_status":"pass"},{"decision":"DENY","failures":[],"policy_path":"native","reason_code":"policy_denied","receipt_id":"receipt:20d0bf4dfe8f9ff41ea60ac45846c3b6","receipt_verification":"verified","risk_class":"indirect_prompt_injection","scenario_id":"POLICY-DENY-INDIRECT-PROMPT-INJECTION","verifier_status":"pass"},{"decision":"DENY","failures":[],"policy_path":"native","reason_code":"policy_denied","receipt_id":"receipt:4df3562ffab1a4ee7eab8adb1804d63b","receipt_verification":"verified","risk_class":"confidential_exfiltration","scenario_id":"POLICY-DENY-CONFIDENTIAL-EXFILTRATION","verifier_status":"pass"},{"decision":"DENY","failures":[],"policy_path":"native","reason_code":"policy_denied","receipt_id":"receipt:34b97041e19b2e4b742e033dc7c907a9","receipt_verification":"verified","risk_class":"tool_misuse","scenario_id":"POLICY-DENY-UNEXPECTED-DELETE","verifier_status":"pass"},{"decision":"DENY","failures":[],"policy_path":"derive_child_passport","reason_code":"policy_denied","receipt_id":"receipt:b2c8d02b6cd035aa4ce557cdafda02d4","receipt_verification":"verified","risk_class":"authority_widening","scenario_id":"POLICY-DENY-AUTHORITY-WIDENING","verifier_status":"pass"},{"decision":"DENY","failures":[],"policy_path":"native","reason_code":"budget_exhausted","receipt_id":"receipt:5433297e64530a7abc35c5c660a8bcd0","receipt_verification":"verified","risk_class":"budget_cost_runaway","scenario_id":"POLICY-DENY-BUDGET-RUNAWAY","verifier_status":"pass"},{"decision":"DENY","failures":[],"policy_path":"native","reason_code":"policy_denied","receipt_id":"receipt:787c2abd775414b406619ed3e3bf55e9","receipt_verification":"verified","risk_class":"unsafe_network_action","scenario_id":"POLICY-DENY-UNSAFE-NETWORK-ACTION","verifier_status":"pass"},{"decision":"DENY","failures":[],"policy_path":"native","reason_code":"policy_denied","receipt_id":"receipt:6e6515f5be0cb4bbb5eca063794c9bb7","receipt_verification":"verified","risk_class":"untrusted_artifact_influence","scenario_id":"POLICY-DENY-UNTRUSTED-ARTIFACT-INFLUENCE","verifier_status":"pass"}],"schema_version":"ardur.policy_conformance_report.v0.1","summary":{"failed":0,"passed":8,"total":8}}
